{
  "schemaVersion": "1.0.0",
  "eventId": "ccc-job-88213-start",
  "runId": "018f2d02-1b3c-7a9e-8f10-2c3d4e5f6a7b",
  "workOrderId": "wo_opifex_318_c1d2e3f_a1",
  "type": "run.started",
  "source": "runner-reported",
  "occurredAt": "2026-08-21T11:00:00.000Z",
  "summary": "Cloud job 88213 accepted",
  "runner": "claude-code-cloud@1.0.0"
}
