{
  "schemaVersion": "1.0.0",
  "eventId": "clr-018f2c31-0001",
  "runId": "018f2c31-7a4e-7c3b-9f21-4d5e6a7b8c9d",
  "workOrderId": "wo_opifex_312_a3f91c2_a1",
  "type": "run.started",
  "source": "runner-reported",
  "occurredAt": "2026-08-21T10:00:00.000Z",
  "summary": "Checked out a3f91c2 on factory/312-a3f91c2-a1",
  "runner": "claude-code-local@2.1.223",
  "trace": { "traceId": "4bf92f3577b34da6a3ce929d0e0e4736", "spanId": "00f067aa0ba902b7" }
}
