{
  "schemaVersion": "1.0.0",
  "eventId": "git:opifex:7c1d9ab0f3e2d5c4b6a8901234567890abcdef12",
  "runId": "018f2d02-1b3c-7a9e-8f10-2c3d4e5f6a7b",
  "workOrderId": "wo_opifex_318_c1d2e3f_a1",
  "type": "run.progress",
  "source": "git-derived",
  "occurredAt": "2026-08-21T11:14:33.000Z",
  "summary": "Commit 7c1d9ab landed on factory/318-c1d2e3f-a1"
}
